business_name,website,phone,email,address,city,state,services
A.S.G. Plumbing Enterprises,https://tucsonazplumber.com/,(520) 333-2121,,"Tucson, AZ 85730",Tucson,AZ,"Emergency Plumbing, Drain Cleaning, Water Heater"
Cummings Plumbing Heating and Cooling,https://cummingsplumbingtucsonaz.com/,(520) 333-2121,,"Tucson, AZ",Tucson,AZ,"Plumbing, Heating, Cooling, Emergency"
Wood's Plumbing,https://woodsplumbing.com/,(520) 682-2233,,"Tucson, AZ",Tucson,AZ,"Emergency Plumbing, Drain, Water Services"
Big Ed's Plumbing,https://bigedsplumbing.com/,,,"Tucson, AZ 85730",Tucson,AZ,"Emergency Plumbing, 24/7 Service"
Roto-Rooter Tucson,https://www.rotorooter.com/tucson/,(520) 518-3769,,"Tucson, AZ",Tucson,AZ,"Emergency Plumbing, Drain Services"
Al Coronado Plumbing,https://alcoronadoplumbing.com/,,,"Tucson, AZ",Tucson,AZ,"Residential Plumbing, Commercial"
Right Now Plumbing,https://rightnowplumbingtucson.com/,,,"Tucson, AZ",Tucson,AZ,"Emergency Plumbing, Licensed, Insured"
Tucson Plumbing & Heating,https://tucsonplumbing.com/,,,"Tucson, AZ",Tucson,AZ,"Emergency Repairs, Drain Cleaning, Water Heater"
Tucson Plumbing Pros,https://tucsonplumbingprosaz.com/,(520) 438-6111,,"Tucson, AZ",Tucson,AZ,"24 Hour Plumbing, Same Day Service"
Tucson 24 Hour Plumber and Drain,http://tucson24hourplumberanddrain.com/,(520) 252-4044,,7729 E. Clarence Pl - Tucson AZ 85715,Tucson,AZ,"Emergency, Water Heater, Drain Cleaning"
On The Way Plumbing,https://otwplumbing.com/,,,"Tucson, AZ",Tucson,AZ,Plumbing Services
